Title,Description,Start Date,End Date,Tags
Round 1 - Program selection (subject POSt) request period on ACORN.,Round 1 - Program selection (subject POSt) request period on ACORN.,2021-03-09,2021-04-30,"Summer,Academic"
View your course enrolment start time on ACORN.,View your course enrolment start time on ACORN.,2021-03-10,2021-03-10,"Enrolment,Summer,Academic"
Course enrolment for UTM degree students begins for the Summer session.,Course enrolment for UTM degree students begins for the Summer session.,2021-03-15,2021-03-15,"Enrolment,Summer,Academic"
Course enrolment for non-degree and visiting students begins.,Course enrolment for non-degree and visiting students begins.,2021-03-16,2021-03-16,"Enrolment,Summer,Academic"
First day to add repeated courses (EXT).,First day to add repeated courses (EXT).,2021-03-16,2021-03-16,"Summer,Academic"
Submit the Course Enrolment Exception Form for F and Y courses. Deadline is May 7 at 1 pm.,Submit the Course Enrolment Exception Form for F and Y courses. Deadline is May 7 at 1 pm.,2021-03-16,2021-05-07,"Forms and Petitions,Summer,Academic"
Submit the Course Enrolment Exception Form for S courses. Deadline is July 9 at 1 pm.,Submit the Course Enrolment Exception Form for S courses. Deadline is July 9 at 1 pm.,2021-03-16,2021-07-09,"Forms and Petitions,Summer,Academic"
Deadline to apply for a Letter of Permission to study at another Canadian university in the Summer Session.,Deadline to apply for a Letter of Permission to study at another Canadian university in the Summer Session.,2021-04-01,2021-04-01,"Summer,Academic"
Courses with priority enrolment controls become available to all UTM students.,Courses with priority enrolment controls become available to all UTM students.,2021-04-01,2021-04-01,"Enrolment,Summer,Academic"
Good Friday. University closed.,Good Friday. University closed.,2021-04-02,2021-04-02,"Financial,Summer,Academic"
First day to request OSAP fee deferrals on ACORN.,First day to request OSAP fee deferrals on ACORN.,2021-04-12,2021-04-12,"Financial,Summer,Academic"
"Beginning at 6 AM, UTM students can enrol in St. George or UTSC courses. Students from other campuses may add UTM courses.","Beginning at 6 AM, UTM students can enrol in St. George or UTSC courses. Students from other campuses may add UTM courses.",2021-04-14,2021-04-14,"Summer,Academic"
Deadline for visiting students to apply for Summer F and/or Y courses.,Deadline for visiting students to apply for Summer F and/or Y courses.,2021-04-15,2021-04-15,"Summer,Academic"
Deadline to pay minimum amount of tuition fees for Summer Session as indicated on ACORN invoice.,Deadline to pay minimum amount of tuition fees for Summer Session as indicated on ACORN invoice.,2021-04-20,2021-04-20,"Financial,Summer,Academic"
"If tuition payment is made during this period, you MUST provide the Office of the Registrar with proof of payment to avoid being removed from classes on April 29.","If tuition payment is made during this period, you MUST provide the Office of the Registrar with proof of payment to avoid being removed from classes on April 29.",2021-04-21,2021-04-28,"Financial,Summer,Academic"
Last day to submit proof of payment to the Office of the Registrar for any tuition payments made late.,Last day to submit proof of payment to the Office of the Registrar for any tuition payments made late.,2021-04-28,2021-04-28,"Financial,Summer,Academic"
"Registration cancelled if payment or deferral of fees has not been received. Students whose ACORN account does not show a ""Registered"" status will be removed from classes.","Registration cancelled if payment or deferral of fees has not been received. Students whose ACORN account does not show a ""Registered"" status will be removed from classes.",2021-04-29,2021-04-29,"Financial,Summer,Academic"
Late registration form opens for F & Y courses.,Late registration form opens for F & Y courses.,2021-04-30,2021-04-30,"Financial,Forms and Petitions,Summer,Academic"
Round 1 - Program selection (subject POSt) request period ends on ACORN.,Round 1 - Program selection (subject POSt) request period ends on ACORN.,2021-04-30,2021-04-30,"Summer,Academic"
Accept an invitation to your subject POSt on ACORN if you applied during Round 1.,Accept an invitation to your subject POSt on ACORN if you applied during Round 1.,2021-05-01,2021-06-02,"Summer,Academic"
Deadline to cancel registration (if only enrolled in F & Y courses) with no minimum charge.,Deadline to cancel registration (if only enrolled in F & Y courses) with no minimum charge.,2021-05-02,2021-05-02,"Financial,Summer,Academic"
Classes begin for F & Y Summer courses.,Classes begin for F & Y Summer courses.,2021-05-03,2021-05-03,"Summer,Academic"
Deadline to submit a petition for a Course Overload.,Deadline to submit a petition for a Course Overload.,2021-05-03,2021-05-03,"Forms and Petitions,Summer,Academic"
Deadline to submit the Course Enrolment Exception Form for F and Y courses (1 pm).,Deadline to submit the Course Enrolment Exception Form for F and Y courses (1 pm).,2021-05-07,2021-05-07,"Forms and Petitions,Summer,Academic"
Waitlist ends for Summer F & Y courses at UTM.,Waitlist ends for Summer F & Y courses at UTM.,2021-05-09,2021-05-09,"Summer,Academic"
Last day to add or change a section in a Summer F or Y course on ACORN.,Last day to add or change a section in a Summer F or Y course on ACORN.,2021-05-09,2021-05-09,"Summer,Academic"
"Last day to drop an F or Y course on ACORN and receive 100% course fee refund, as long as you are still registered in other courses for the session.","Last day to drop an F or Y course on ACORN and receive 100% course fee refund, as long as you are still registered in other courses for the session.",2021-05-09,2021-05-09,"Summer,Financial,Drop Deadlines,Academic"
Request Second Attempt for Credit for F courses.,Request Second Attempt for Credit for F courses.,2021-05-10,2021-06-14,"Summer,Academic"
Request Second Attempt for Credit for Y courses.,Request Second Attempt for Credit for Y courses.,2021-05-10,2021-08-16,"Summer,Academic"
Request or cancel Credit/No Credit on ACORN for F courses at UTM,Request or cancel Credit/No Credit on ACORN for F courses at UTM,2021-05-10,2021-06-14,"Cr/NCr,Summer,Academic"
Request or cancel Credit/No Credit on ACORN for Y courses at UTM.,Request or cancel Credit/No Credit on ACORN for Y courses at UTM.,2021-05-10,2021-08-16,"Cr/NCr,Summer,Academic"
Request or cancel Credit/No Credit on ACORN for F courses taken at St.George.,Request or cancel Credit/No Credit on ACORN for F courses taken at St.George.,2021-05-10,2021-06-14,"Cr/NCr,Summer,Academic"
Request or cancel Credit/No Credit on ACORN for Y courses taken at St.George.,Request or cancel Credit/No Credit on ACORN for Y courses taken at St.George.,2021-05-10,2021-08-16,"Cr/NCr,Summer,Academic"
Request or cancel Credit/No Credit on ACORN for F courses taken at U of T Scarborough (UTSC).,Request or cancel Credit/No Credit on ACORN for F courses taken at U of T Scarborough (UTSC).,2021-05-10,2021-06-21,"Cr/NCr,Summer,Academic"
Request or cancel Credit/No Credit on ACORN for Y courses taken at U of T Scarborough (UTSC).,Request or cancel Credit/No Credit on ACORN for Y courses taken at U of T Scarborough (UTSC).,2021-05-10,2021-08-11,"Cr/NCr,Summer,Academic"
Presidential Day. University closed.,Presidential Day. University closed.,2021-05-21,2021-05-21,"Financial,Summer,Academic"
Victoria Day. University closed.,Victoria Day. University closed.,2021-05-24,2021-05-24,"Financial,Summer,Academic"
"Recommended deadline to pay for Summer Session Tuition & Non-Tuition fee amounts in full to avoid monthly service charges (beginning June 15, 2021)","Recommended deadline to pay for Summer Session Tuition & Non-Tuition fee amounts in full to avoid monthly service charges (beginning June 15, 2021)",2021-05-31,2021-05-31,"Financial,Summer,Academic"
Last day to drop a Summer F course from academic record.,Last day to drop a Summer F course from academic record.,2021-06-01,2021-06-01,"Drop Deadlines,Summer,Academic"
Deadline to accept a subject POSt invitation on ACORN (Round 1).,Deadline to accept a subject POSt invitation on ACORN (Round 1).,2021-06-02,2021-06-02,"Summer,Academic"
Request period for Late Withdrawal (LWD) for F courses at UTM and St. George,Request period for Late Withdrawal (LWD) for F courses at UTM and St. George,2021-06-02,2021-06-14,"LWD,Summer,Academic"
Request period for Late Withdrawal (LWD) for F courses at UTSC,Request period for Late Withdrawal (LWD) for F courses at UTSC,2021-06-02,2021-06-21,"LWD,Summer,Academic"
Round 2 - Program selection (subject POSt) request period on ACORN.,Round 2 - Program selection (subject POSt) request period on ACORN.,2021-06-07,2021-08-27,"Summer,Academic"
Accept an invitation to your subject POSt on ACORN if you applied during Round 2.,Accept an invitation to your subject POSt on ACORN if you applied during Round 2.,2021-06-08,2021-09-20,"Summer,Academic"
For students enrolled in S courses only after April 29: Deadline to pay minimum amount of tuition fees as indicated on ACORN invoice.,For students enrolled in S courses only after April 29: Deadline to pay minimum amount of tuition fees as indicated on ACORN invoice.,2021-06-13,2021-06-13,"Financial,Summer,Academic"
Deadline to submit Second Attempt for Credit for F courses.,Deadline to submit Second Attempt for Credit for F courses.,2021-06-14,2021-06-14,"Summer,Academic"
"Last day to request or cancel Credit/No Credit for UTM F courses with a final exam. If there is no final exam, request or cancel CR/NCR before the last assignment or test is due in the course.","Last day to request or cancel Credit/No Credit for UTM F courses with a final exam. If there is no final exam, request or cancel CR/NCR before the last assignment or test is due in the course.",2021-06-14,2021-06-14,"Cr/NCr,Summer,Academic"
Last day to request or cancel Credit/No Credit on ACORN for F courses taken at St.George.,Last day to request or cancel Credit/No Credit on ACORN for F courses taken at St.George.,2021-06-14,2021-06-14,"Cr/NCr,Summer,Academic"
Summer F classes end. ,Summer F classes end. ,2021-06-14,2021-06-14,"Summer,Academic"
Last day to request Late Withdrawal (LWD) for F courses at UTM and St. George,Last day to request Late Withdrawal (LWD) for F courses at UTM and St. George,2021-06-14,2021-06-14,"LWD,Summer,Academic"
Term break for Y classes begins (Y classes resume July 5).,Term break for Y classes begins (Y classes resume July 5).,2021-06-15,2021-07-02,"Breaks,Summer,Academic"
Deadline for visiting students to apply for Summer S courses.,Deadline for visiting students to apply for Summer S courses.,2021-06-15,2021-06-15,"Summer,Academic"
Make-up day for classes missed on May 21 due to Presidential Day.,Make-up day for classes missed on May 21 due to Presidential Day.,2021-06-15,2021-06-15,"Summer,Academic"
Final exam period for Summer F courses.,Final exam period for Summer F courses.,2021-06-17,2021-06-19,"Summer,Academic"
Last day to request or cancel Credit/No Credit on ACORN for F courses taken at U of T Scarborough (UTSC).,Last day to request or cancel Credit/No Credit on ACORN for F courses taken at U of T Scarborough (UTSC).,2021-06-21,2021-06-21,"Cr/NCr,Summer,Academic"
Last day to request Late Withdrawal (LWD) for F courses at UTSC,Last day to request Late Withdrawal (LWD) for F courses at UTSC,2021-06-21,2021-06-21,"LWD,Summer,Academic"
UTM Graduation,UTM Graduation,2021-06-23,2021-06-23,"Financial,Summer,Academic"
Summer F course deferred exam period.,Summer F course deferred exam period.,2021-06-23,2021-06-25,"Summer,Academic"
"For students who enrolled in S courses only as of April 30, this is the last day to show proof of payment to the Office of the Registrar.","For students who enrolled in S courses only as of April 30, this is the last day to show proof of payment to the Office of the Registrar.",2021-06-28,2021-06-28,"Summer,Academic"
"For students who enrolled in S courses only as of April 30, registration cancelled if payment or deferral of fees has not been received. Students whose ACORN account does not show ""Registered"" status will be removed from classes.","For students who enrolled in S courses only as of April 30, registration cancelled if payment or deferral of fees has not been received. Students whose ACORN account does not show ""Registered"" status will be removed from classes.",2021-06-29,2021-06-29,"Financial,Summer,Academic"
November Convocation request period. Students may also withdraw their graduation request during this time.,November Convocation request period. Students may also withdraw their graduation request during this time.,2021-06-29,2021-09-08,"Financial,Summer,Academic"
Late registration form opens for S courses.,Late registration form opens for S courses.,2021-06-30,2021-06-30,"Financial,Forms and Petitions,Summer,Academic"
Canada Day. University closed.,Canada Day. University closed.,2021-07-01,2021-07-01,"Financial,Summer,Academic"
Presidential Day. University closed.,Presidential Day. University closed.,2021-07-02,2021-07-02,"Financial,Summer,Academic"
Deadline to cancel registration (if only enrolled in Summer S courses) with no minimum charge.,Deadline to cancel registration (if only enrolled in Summer S courses) with no minimum charge.,2021-07-04,2021-07-04,"Financial,Summer,Academic"
"Summer Y classes resume, and Summer S classes begin.","Summer Y classes resume, and Summer S classes begin.",2021-07-05,2021-07-05,"Summer,Academic"
Deadline to submit a petition for Course Overload for S courses.,Deadline to submit a petition for Course Overload for S courses.,2021-07-05,2021-07-05,"Forms and Petitions,Summer,Academic"
Deadline to submit the Course Enrolment Exception Form for S courses at 1 pm.,Deadline to submit the Course Enrolment Exception Form for S courses at 1 pm.,2021-07-09,2021-07-09,"Forms and Petitions,Summer,Academic"
Waitlist ends for Summer S courses at UTM.,Waitlist ends for Summer S courses at UTM.,2021-07-11,2021-07-11,"Summer,Academic"
Last day to add or change a section in a Summer S course on ACORN.,Last day to add or change a section in a Summer S course on ACORN.,2021-07-11,2021-07-11,"Summer,Academic"
Request Second Attempt for Credit for S courses.,Request Second Attempt for Credit for S courses.,2021-07-12,2021-08-16,"Summer,Academic"
Request or cancel Credit/No Credit on ACORN for S courses at UTM.,Request or cancel Credit/No Credit on ACORN for S courses at UTM.,2021-07-12,2021-08-16,"Cr/NCr,Summer,Academic"
Request or cancel Credit/No Credit on ACORN for S courses taken at St.George.,Request or cancel Credit/No Credit on ACORN for S courses taken at St.George.,2021-07-12,2021-08-16,"Cr/NCr,Summer,Academic"
Request or cancel Credit/No Credit on ACORN for S courses taken at U of T Scarborough (UTSC).,Request or cancel Credit/No Credit on ACORN for S courses taken at U of T Scarborough (UTSC).,2021-07-12,2021-08-11,"Cr/NCr,Summer,Academic"
Last day to drop a Summer Y course from academic record.,Last day to drop a Summer Y course from academic record.,2021-07-25,2021-07-25,"Drop Deadlines,Summer,Academic"
Request period for Late Withdrawal (LWD) for Y courses at UTM and St. George,Request period for Late Withdrawal (LWD) for Y courses at UTM and St. George,2021-07-26,2021-08-16,"LWD,Summer,Academic"
Request period for Late Withdrawal (LWD) for Y courses at UTSC,Request period for Late Withdrawal (LWD) for Y courses at UTSC,2021-07-26,2021-08-11,"LWD,Summer,Academic"
Last day to drop an S course from academic record.,Last day to drop an S course from academic record.,2021-08-02,2021-08-02,"Drop Deadlines,Summer,Academic"
Civic holiday. University closed.,Civic holiday. University closed.,2021-08-02,2021-08-02,"Financial,Fall/Winter,Summer,Academic"
Request period for Late Withdrawal (LWD) for S courses at UTM and St. George,Request period for Late Withdrawal (LWD) for S courses at UTM and St. George,2021-08-03,2021-08-16,"LWD,Summer,Academic"
Request period for Late Withdrawal (LWD) for S courses at UTSC,Request period for Late Withdrawal (LWD) for S courses at UTSC,2021-08-03,2021-08-11,"LWD,Summer,Academic"
Last day to request or cancel Credit/No Credit on ACORN for Y and S courses taken at U of T Scarborough (UTSC).,Last day to request or cancel Credit/No Credit on ACORN for Y and S courses taken at U of T Scarborough (UTSC).,2021-08-11,2021-08-11,"Cr/NCr,Summer,Academic"
Last day to request Late Withdrawal (LWD) for Y & S courses at UTSC,Last day to request Late Withdrawal (LWD) for Y & S courses at UTSC,2021-08-11,2021-08-11,"LWD,Summer,Academic"
Deadline to request Second Attempt for Credit for Y or S courses.,Deadline to request Second Attempt for Credit for Y or S courses.,2021-08-16,2021-08-16,"Summer,Academic"
"Last day to request or cancel Credit/No Credit on ACORN for UTM Y and S courses with a final exam. If there is no final exam, request or cancel CR/NCR before the last assignment or test is due in the course.","Last day to request or cancel Credit/No Credit on ACORN for UTM Y and S courses with a final exam. If there is no final exam, request or cancel CR/NCR before the last assignment or test is due in the course.",2021-08-16,2021-08-16,"Cr/NCr,Summer,Academic"
Last day to request or cancel Credit/No Credit on ACORN for Y and S courses taken at St.George.,Last day to request or cancel Credit/No Credit on ACORN for Y and S courses taken at St.George.,2021-08-16,2021-08-16,"Cr/NCr,Summer,Academic"
Summer Y & S classes end.,Summer Y & S classes end.,2021-08-16,2021-08-16,"Financial,Summer,Academic"
Last day to request Late Withdrawal (LWD) for Y & S courses at UTM and St. George,Last day to request Late Withdrawal (LWD) for Y & S courses at UTM and St. George,2021-08-16,2021-08-16,"LWD,Summer,Academic"
Study Break,Study Break,2021-08-17,2021-08-17,"Breaks,Summer,Academic"
Final exam period for Summer Y & S courses.,Final exam period for Summer Y & S courses.,2021-08-18,2021-08-20,"Summer,Academic"
Deferred exam period for Summer Y & S courses.,Deferred exam period for Summer Y & S courses.,2021-08-25,2021-08-27,"Summer,Academic"
Round 2 - Program selection (subject POSt) request period ends on ACORN.,Round 2 - Program selection (subject POSt) request period ends on ACORN.,2021-08-27,2021-08-27,"Summer,Academic"
Deadline to accept a subject POSt invitation on ACORN (Round 2).,Deadline to accept a subject POSt invitation on ACORN (Round 2).,2021-09-20,2021-09-20,"Summer,Academic"
Fees for the Summer session are posted on ACORN.,Fees for the Summer session are posted on ACORN.,2021-04-12,2021-04-12,"Financial,Summer"
"Last day to defer fees for OSAP for F and Y courses on ACORN. If you're unable to defer your fees on ACORN, you may use the Fee Deferral Form instead.","Last day to defer fees for OSAP for F and Y courses on ACORN. If you're unable to defer your fees on ACORN, you may use the Fee Deferral Form instead.",2021-04-28,2021-04-28,"Financial,Forms and Petitions,Summer"
Last day to drop a Summer F course on ACORN to receive a 75% course fee refund.,Last day to drop a Summer F course on ACORN to receive a 75% course fee refund.,2021-05-16,2021-05-16,"Drop Deadlines,Financial,Summer"
Last day to drop a Summer Y course on ACORN for a 75% course fee refund.,Last day to drop a Summer Y course on ACORN for a 75% course fee refund.,2021-05-25,2021-05-25,"Drop Deadlines,Financial,Summer"
Last day to drop a Summer F course on ACORN for a 50% course fee refund.,Last day to drop a Summer F course on ACORN for a 50% course fee refund.,2021-06-01,2021-06-01,"Drop Deadlines,Financial,Summer"
Last day to drop a Summer Y course on ACORN for a 50% course fee refund.,Last day to drop a Summer Y course on ACORN for a 50% course fee refund.,2021-06-08,2021-06-08,"Drop Deadlines,Financial,Summer"
Service charges on outstanding Summer Session fee balances begin.,Service charges on outstanding Summer Session fee balances begin.,2021-06-15,2021-06-15,"Financial,Summer"
"Last day to apply for OSAP for students taking courses held from May to August, that did NOT receive OSAP in Fall-Winter 2020-2021.","Last day to apply for OSAP for students taking courses held from May to August, that did NOT receive OSAP in Fall-Winter 2020-2021.",2021-06-21,2021-06-21,"Financial,Summer"
Last day to defer fees for OSAP on ACORN for students enrolled in S courses only as of April 30.,Last day to defer fees for OSAP on ACORN for students enrolled in S courses only as of April 30.,2021-06-28,2021-06-28,"Financial,Summer"
"Last day to drop an S course on ACORN and receive 100% course fee refund, as long as you are still registered in other courses for the session.","Last day to drop an S course on ACORN and receive 100% course fee refund, as long as you are still registered in other courses for the session.",2021-07-11,2021-07-11,"Drop Deadlines,Financial,Summer"
"Last day to apply for OSAP for students taking courses held from May to August, who received OSAP in the Fall-Winter 2020-2021","Last day to apply for OSAP for students taking courses held from May to August, who received OSAP in the Fall-Winter 2020-2021",2021-07-11,2021-07-11,"Financial,Summer"
Last day to drop an S course on ACORN for a 75% course fee refund.,Last day to drop an S course on ACORN for a 75% course fee refund.,2021-07-18,2021-07-18,"Drop Deadlines,Financial,Summer"
Last day to drop a Summer S course on ACORN for a 50% course fee refund.,Last day to drop a Summer S course on ACORN for a 50% course fee refund.,2021-08-02,2021-08-02,"Drop Deadlines,Financial,Summer"
Deadline to pay all outstanding fees for the Summer session.,Deadline to pay all outstanding fees for the Summer session.,2021-08-31,2021-08-31,"Financial,Summer"
First day to accept an invitation to your subject POSt on ACORN if you applied during Round 1 (March 09 - April 30).,First day to accept an invitation to your subject POSt on ACORN if you applied during Round 1 (March 09 - April 30).,2021-05-01,2021-05-01,"Fall/Winter,Academic"
Last day to accept an invitation to your subject POSt on ACORN if you applied during Round 1 (March 09 ‐ April 30).,Last day to accept an invitation to your subject POSt on ACORN if you applied during Round 1 (March 09 ‐ April 30).,2021-06-02,2021-06-02,"Fall/Winter,Academic"
Round 2 - Program selection (subject POSt): First day to request Type 2 & 3 Subject POSts on ACORN.,Round 2 - Program selection (subject POSt): First day to request Type 2 & 3 Subject POSts on ACORN.,2021-06-07,2021-06-07,"Fall/Winter,Academic"
First day to accept an invitation to your subject POSt on ACORN if you applied during Round 2 (June 07 - August 27).,First day to accept an invitation to your subject POSt on ACORN if you applied during Round 2 (June 07 - August 27).,2021-06-08,2021-06-08,"Fall/Winter,Academic"
Year 4 and Year 5 students: View your course enrolment start time on ACORN.,Year 4 and Year 5 students: View your course enrolment start time on ACORN.,2021-06-16,2021-06-16,"Financial,Fall/Winter,Enrolment,Academic"
Fourth-year and fifth-year course enrolment begins (14.0 or more credits).,Fourth-year and fifth-year course enrolment begins (14.0 or more credits).,2021-06-22,2021-06-22,"Fall/Winter,Enrolment,Academic"
Year 3 students: View your course enrolment start time on ACORN.,Year 3 students: View your course enrolment start time on ACORN.,2021-06-23,2021-06-23,"Financial,Fall/Winter,Enrolment,Academic"
Third‐year course enrolment begins (9.0 to 13.5 credits).,Third‐year course enrolment begins (9.0 to 13.5 credits).,2021-06-29,2021-06-29,"Fall/Winter,Enrolment,Academic"
First day to confirm or withdraw November 2021 graduation request on ACORN.,First day to confirm or withdraw November 2021 graduation request on ACORN.,2021-06-29,2021-06-29,"Financial,Fall/Winter,Academic"
Deadline to apply for a Letter of Permission to study at another Canadian university for the Fall session.,Deadline to apply for a Letter of Permission to study at another Canadian university for the Fall session.,2021-07-01,2021-07-01,"Fall/Winter,Academic"
Canada Day. University Closed.,Canada Day. University Closed.,2021-07-01,2021-07-01,"Financial,Fall/Winter,Academic"
Presidential Day. University Closed.,Presidential Day. University Closed.,2021-07-02,2021-07-02,"Financial,Fall/Winter,Academic"
Year 2 students: View your course enrolment start time on ACORN.,Year 2 students: View your course enrolment start time on ACORN.,2021-07-08,2021-07-08,"Financial,Fall/Winter,Enrolment,Academic"
Second year course enrolment begins (4.0 to 8.5 credits).,Second year course enrolment begins (4.0 to 8.5 credits).,2021-07-14,2021-07-14,"Fall/Winter,Enrolment,Academic"
"Year 1 students: View your 8:00 a.m. course enrolment start time on ACORN. (Note: the original date was July 15. Due to technical issues, start times will be visible on July 16.)","Year 1 students: View your 8:00 a.m. course enrolment start time on ACORN. (Note: the original date was July 15. Due to technical issues, start times will be visible on July 16.)",2021-07-16,2021-07-16,"Financial,Fall/Winter,Enrolment,Academic"
First year course enrolment begins at 8:00 a.m. (3.5 credits or less).,First year course enrolment begins at 8:00 a.m. (3.5 credits or less).,2021-07-21,2021-07-21,"Fall/Winter,Enrolment,Academic"
Fall-Winter course enrolment limit will increase from 5.0 credits to 6.0 credits at 6AM.,Fall-Winter course enrolment limit will increase from 5.0 credits to 6.0 credits at 6AM.,2021-07-28,2021-07-28,"Fall/Winter,Enrolment,Academic"
